{
  "record_type": "assessment",
  "schema_version": "1.0",
  "record_id": "assessment.patch-and-incident.001",
  "subject_id": "host.example.internal",
  "assessed_at": "2026-10-25T12:15:00Z",
  "verdict": "needs_investigation",
  "patch_status": "verified_fixed",
  "patch_evidence_ids": ["obs.runtime.001", "source.vendor.package-index"],
  "compromise_evidence": {
    "status": "confirmed",
    "evidence_ids": ["obs.compromise.indicator"]
  },
  "rationale": "The package evidence supports the fixed patch status, while separate confirmed compromise evidence still requires investigation."
}
