{
  "record_type": "assessment",
  "schema_version": "1.0",
  "record_id": "assessment.php-patch.001",
  "subject_id": "host.example.internal",
  "assessed_at": "2026-10-25T12:15:00Z",
  "verdict": "verified_fixed",
  "patch_status": "verified_fixed",
  "patch_evidence_ids": ["obs.runtime.001", "source.vendor.package-index"],
  "compromise_evidence": {
    "status": "none_observed",
    "evidence_ids": []
  },
  "rationale": "The installed package build is supported by the supplied vendor package evidence. This does not establish whether compromise occurred."
}
