{
  "record_type": "assessment",
  "schema_version": "1.0",
  "record_id": "assessment.php.unknown.001",
  "subject_id": "host.example.internal",
  "assessed_at": "2026-10-25T12:15:00Z",
  "verdict": "unknown",
  "patch_status": "unknown",
  "patch_evidence_ids": [],
  "compromise_evidence": {
    "status": "unknown",
    "evidence_ids": []
  },
  "rationale": "Available evidence does not determine patch status or compromise status."
}
